{
  "schemaVersion": "molit.korean-interoperability-register/1",
  "asOf": "2026-07-12",
  "profileVersion": "0.1.0",
  "claimPolicy": {
    "institutionalConformanceAllowed": false,
    "publicClaim": "공개 스키마와 고정 공개 fixture를 대상으로 시험한 Working Draft",
    "blockedClaimPatterns": [
      "KS 적합",
      "국내 기관 메타데이터와 완전 상호운용",
      "ISO 19115 무손실 왕복 변환",
      "ISO 19157 무손실 왕복 변환",
      "공공데이터포털과 완전 호환",
      "KS compliant",
      "KS 준수",
      "KS 부합",
      "KS 호환",
      "conforms to KS",
      "compliant with KS",
      "KS conformant",
      "fully interoperable with Korean institutional metadata",
      "lossless ISO 19115 round-trip",
      "lossless ISO 19157 round-trip",
      "fully compatible with data.go.kr"
    ]
  },
  "standards": [
    {
      "id": "KS-X-ISO-19115-1",
      "title": "지리정보 — 메타데이터 — 제1부: 기본사항",
      "issuer": "국토교통부",
      "kind": "national-standard",
      "status": "current",
      "statusEventType": "confirmed",
      "statusEventDate": "2025-12-12",
      "statusObservedAt": "2026-07-12",
      "statusEvidence": "official-metadata-verified",
      "accessMode": "paid-fulltext",
      "officialUrl": "https://www.standard.go.kr/KSCI/standardIntro/getStandardSearchView.do?ksNo=KSXISO19115-1&menuId=919&reformNo=05&tmprKsNo=KSXISO19115&topMenuId=502&upperMenuId=503",
      "profileRole": "공간 데이터와 서비스의 메타데이터 개념모델",
      "implementationEvidence": "not-applicable",
      "crosswalkEvidence": "title-scope-only",
      "normativeUse": "allowed-reference",
      "conformanceClaimAllowed": false,
      "blockers": [
        "licensed-fulltext-not-reviewed",
        "clause-mapping-not-complete"
      ],
      "sourceIds": [
        "SRC-STD-003"
      ]
    },
    {
      "id": "KS-X-ISO-19115-2",
      "title": "지리정보 — 메타데이터 — 제2부: 획득 및 처리를 위한 확장",
      "issuer": "국토교통부",
      "kind": "national-standard",
      "status": "current",
      "statusEventType": "revised",
      "statusEventDate": "2025-01-24",
      "statusObservedAt": "2026-07-12",
      "statusEvidence": "official-metadata-verified",
      "accessMode": "paid-fulltext",
      "officialUrl": "https://www.kssn.net/search/stddetail.do?itemNo=K001010152645",
      "profileRole": "센서·영상·관측 자료의 획득 및 처리 메타데이터",
      "implementationEvidence": "not-applicable",
      "crosswalkEvidence": "title-scope-only",
      "normativeUse": "allowed-reference",
      "conformanceClaimAllowed": false,
      "blockers": [
        "licensed-fulltext-not-reviewed",
        "acquisition-extension-mapping-not-complete"
      ],
      "sourceIds": [
        "SRC-STD-007"
      ]
    },
    {
      "id": "KS-X-ISO-19115-3",
      "title": "지리정보 — 메타데이터 — 제3부: 기본 개념을 위한 XML 스키마 구현",
      "issuer": "국토교통부",
      "kind": "national-standard",
      "status": "current",
      "statusEventType": "established",
      "statusEventDate": "2025-12-12",
      "statusObservedAt": "2026-07-12",
      "statusEvidence": "official-metadata-verified",
      "accessMode": "paid-fulltext",
      "officialUrl": "https://www.kssn.net/search/stddetail.do?itemNo=K001010155509",
      "profileRole": "현행 ISO 19115 XML XSD·Schematron 구현 경로",
      "implementationEvidence": "implementation-tested",
      "crosswalkEvidence": "clause-crosswalk-blocked",
      "normativeUse": "allowed-reference",
      "conformanceClaimAllowed": false,
      "blockers": [
        "licensed-fulltext-not-reviewed",
        "official-bytes-private-cache-not-approved",
        "xml-rdf-roundtrip-not-tested",
        "institution-xml-fixtures-not-tested"
      ],
      "sourceIds": [
        "SRC-STD-008",
        "SRC-TECH-033"
      ]
    },
    {
      "id": "KS-X-ISO-19157-1",
      "title": "지리정보 — 데이터 품질 — 제1부: 일반적인 요구사항",
      "issuer": "국토교통부",
      "kind": "national-standard",
      "status": "current",
      "statusEventType": "established",
      "statusEventDate": "2025-12-12",
      "statusObservedAt": "2026-07-12",
      "statusEvidence": "official-metadata-verified",
      "accessMode": "paid-fulltext",
      "officialUrl": "https://www.kssn.net/search/stddetail.do?itemNo=K001010155510",
      "profileRole": "품질 요소·척도·평가·보고 구조",
      "implementationEvidence": "public-schema-identified",
      "crosswalkEvidence": "clause-crosswalk-blocked",
      "normativeUse": "allowed-reference",
      "conformanceClaimAllowed": false,
      "blockers": [
        "licensed-fulltext-not-reviewed",
        "supported-quality-result-types-not-declared",
        "quality-roundtrip-not-tested"
      ],
      "sourceIds": [
        "SRC-STD-009",
        "SRC-TECH-035"
      ]
    },
    {
      "id": "KS-X-ISO-19157",
      "title": "지리 정보 — 데이터 품질",
      "issuer": "국토교통부",
      "kind": "national-standard",
      "status": "current",
      "statusEventType": "confirmed",
      "statusEventDate": "2025-12-12",
      "statusObservedAt": "2026-07-12",
      "statusEvidence": "official-metadata-verified",
      "accessMode": "paid-fulltext",
      "officialUrl": "https://www.kssn.net/search/stddetail.do?itemNo=K001010130237",
      "profileRole": "기존 국내 공간 제품표준이 인용하는 데이터 품질 계열",
      "implementationEvidence": "public-schema-identified",
      "crosswalkEvidence": "clause-crosswalk-blocked",
      "normativeUse": "allowed-reference",
      "conformanceClaimAllowed": false,
      "blockers": [
        "licensed-fulltext-not-reviewed",
        "product-standard-applicability-router-not-complete",
        "quality-roundtrip-not-tested"
      ],
      "sourceIds": [
        "SRC-STD-024",
        "SRC-TECH-034"
      ]
    },
    {
      "id": "KS-X-ISO-TS-19157-2",
      "title": "지리정보 — 데이터 품질 — 제2부: XML 스키마 구현",
      "issuer": "국토교통부",
      "kind": "national-standard",
      "status": "current",
      "statusEventType": "confirmed",
      "statusEventDate": "2025-12-12",
      "statusObservedAt": "2026-07-12",
      "statusEvidence": "official-metadata-verified",
      "accessMode": "paid-fulltext",
      "officialUrl": "https://www.kssn.net/search/stddetail.do?itemNo=K001010156365",
      "profileRole": "KS X ISO 19157:2013 계열 데이터 품질 XML 인코딩",
      "implementationEvidence": "not-tested",
      "crosswalkEvidence": "clause-crosswalk-blocked",
      "normativeUse": "allowed-reference",
      "conformanceClaimAllowed": false,
      "blockers": [
        "licensed-fulltext-not-reviewed",
        "legacy-quality-xsd-not-pinned",
        "quality-xml-roundtrip-not-tested"
      ],
      "sourceIds": [
        "SRC-STD-025"
      ]
    },
    {
      "id": "KS-X-ISO-19131",
      "title": "지리정보 — 데이터 제품 사양",
      "issuer": "국토교통부",
      "kind": "national-standard",
      "status": "current",
      "statusEventType": "revised",
      "statusEventDate": "2025-01-24",
      "statusObservedAt": "2026-07-12",
      "statusEvidence": "official-metadata-verified",
      "accessMode": "paid-fulltext",
      "officialUrl": "https://www.standard.go.kr/KSCI/standardIntro/getStandardSearchView.do?ksNo=KSXISO19131&menuId=919&reformNo=03&tmprKsNo=KSXISO19131&topMenuId=502&upperMenuId=503",
      "profileRole": "품질 합격값을 포함하는 데이터 제품 사양의 별도 근거",
      "implementationEvidence": "not-applicable",
      "crosswalkEvidence": "title-scope-only",
      "normativeUse": "allowed-reference",
      "conformanceClaimAllowed": false,
      "blockers": [
        "licensed-fulltext-not-reviewed",
        "product-specification-linkage-not-complete"
      ],
      "sourceIds": [
        "SRC-STD-005"
      ]
    },
    {
      "id": "KS-X-ISO-19110",
      "title": "지리정보 — 지형지물 목록작성 방법론",
      "issuer": "국토교통부",
      "kind": "national-standard",
      "status": "current",
      "statusEventType": "confirmed",
      "statusEventDate": "2024-05-17",
      "statusObservedAt": "2026-07-12",
      "statusEvidence": "official-metadata-verified",
      "accessMode": "paid-fulltext",
      "officialUrl": "https://standard.go.kr/KSCI/standardIntro/getStandardSearchView.do?ksNo=KSXISO19110&menuId=503&pageIndex=1&pageUnit=10&reformNo=03&tmprKsNo=KSXISO19110&topMenuId=502",
      "profileRole": "지형지물 유형·속성 카탈로그와 Dataset 메타데이터의 연결",
      "implementationEvidence": "not-applicable",
      "crosswalkEvidence": "title-scope-only",
      "normativeUse": "allowed-reference",
      "conformanceClaimAllowed": false,
      "blockers": [
        "licensed-fulltext-not-reviewed",
        "feature-catalog-linkage-not-complete"
      ],
      "sourceIds": [
        "SRC-STD-021"
      ]
    },
    {
      "id": "KS-X-ISO-19111",
      "title": "지리정보 — 좌표에 의한 참조",
      "issuer": "국토교통부",
      "kind": "national-standard",
      "status": "current",
      "statusEventType": "revised",
      "statusEventDate": "2025-01-24",
      "statusObservedAt": "2026-07-12",
      "statusEvidence": "official-metadata-verified",
      "accessMode": "paid-fulltext",
      "officialUrl": "https://www.standard.go.kr/KSCI/standardIntro/getStandardSearchView.do?ksNo=KSXISO19111&menuId=919&reformNo=04&tmprKsNo=KSXISO19111&topMenuId=502&upperMenuId=503",
      "profileRole": "CRS 식별과 좌표축 의미",
      "implementationEvidence": "implementation-tested",
      "crosswalkEvidence": "title-scope-only",
      "normativeUse": "allowed-reference",
      "conformanceClaimAllowed": false,
      "blockers": [
        "licensed-fulltext-not-reviewed",
        "coordinate-transformation-accuracy-not-tested",
        "non-point-geometry-coverage-incomplete"
      ],
      "sourceIds": [
        "SRC-STD-004"
      ]
    },
    {
      "id": "KS-X-ISO-19135-1",
      "title": "지리정보 — 항목 등록 절차 — 제1부: 기본사항",
      "issuer": "국토교통부",
      "kind": "national-standard",
      "status": "current",
      "statusEventType": "confirmed",
      "statusEventDate": "2024-12-27",
      "statusObservedAt": "2026-07-12",
      "statusEvidence": "official-metadata-verified",
      "accessMode": "paid-fulltext",
      "officialUrl": "https://www.standard.go.kr/KSCI/standardIntro/getStandardSearchView.do?ksNo=KSXISO19135-1&menuId=919&topMenuId=502&upperMenuId=503",